{
  "source_id": "voice-first-media-interface-2026-04",
  "title": "Voice-First Media Agent：影音內容的對話式知識介面",
  "source_type": "markdown",
  "path": "sources/inbox/voice-first-media-interface-2026-04.md",
  "captured_at": "2026-04-25T22:57:34.387Z",
  "content_hash": "sha256:0c38e5194977cb40711ffb66cf0ad07c52ab7dca577a189070dc6bec3ee0b3de",
  "language": "zh-Hant",
  "tags": [
    "voice-first",
    "media-interface",
    "post-ui",
    "retrieval"
  ],
  "status": "inbox",
  "notes": "Curated from thinking_with_ai/projects as a high-value Thought Atlas source."
}
