{
  "source_id": "human-needs-ai-leverage-2026-03-12",
  "title": "降維打擊與人性需求",
  "source_type": "markdown",
  "path": "sources/inbox/human-needs-ai-leverage-2026-03-12.md",
  "captured_at": "2026-04-25T22:57:34.337Z",
  "content_hash": "sha256:970f821ada91f14c421162f8e998261ae761e140f528675a4ff823a8ebfdcdd1",
  "language": "zh-Hant",
  "tags": [
    "human-needs",
    "ai-leverage",
    "business-strategy",
    "product-philosophy"
  ],
  "status": "inbox",
  "notes": "Curated from thinking_with_ai/projects as a high-value Thought Atlas source."
}
