{
  "source_id": "original-conversation-2026-04-11",
  "title": "午休路上的冰淇淋店、投入感與 AI 創作方法論",
  "source_type": "slack_file",
  "path": "sources/inbox/original-conversation-2026-04-11.md",
  "captured_at": "2026-04-25T19:04:19.076Z",
  "content_hash": "sha256:6e93b8292ef0698cf23c9a81bfed0a5abc17569a7824c61fc4e45479c59cd92c",
  "language": "zh-Hant",
  "tags": [
    "meaning",
    "creative-methodology",
    "ai-collaboration",
    "life-design"
  ],
  "status": "inbox",
  "origin": {
    "channel": "slack",
    "sender": "Jones",
    "message_id": "1777143825.974469"
  }
}
