{
  "source_id": "blind-mode-ux-2026-03-31",
  "title": "Blind Mode UX 與無介面時代",
  "source_type": "markdown",
  "path": "sources/inbox/blind-mode-ux-2026-03-31.md",
  "captured_at": "2026-04-25T22:57:34.237Z",
  "content_hash": "sha256:e73e93daf293ba38873439dffafcd80a7c966ad6050bc641b3a54cbd02a48428",
  "language": "zh-Hant",
  "tags": [
    "blind-mode",
    "post-ui",
    "signal-api",
    "product-philosophy"
  ],
  "status": "inbox",
  "notes": "Curated from thinking_with_ai/projects as a high-value Thought Atlas source."
}
