{
  "source_id": "ai-irreplaceability-lived-experience-2026-09-25",
  "title": "AI、不可取代性與「不要錯過自己真正想活的人生」",
  "source_type": "conversation",
  "path": "sources/inbox/ai-irreplaceability-lived-experience-2026-09-25.md",
  "captured_at": "2026-09-25T04:52:22.643Z",
  "content_hash": "sha256:b2d58a915be8d15bcdcec5c661df32670860fedea29f47ae035a39f3546559d8",
  "language": "zh-Hant",
  "tags": [
    "irreplaceability",
    "lived-experience",
    "creation",
    "identity",
    "ai-era-values",
    "ai-collaboration"
  ],
  "status": "inbox",
  "notes": "Verbatim copy of jonesandjay123/thinking_with_ai conversations/ai-irreplaceability-lived-experience-2026-09-25/README.md at commit a613104baaa40ae99d9c4d14d31c06eb2fd7a483 (Jones × GPT conversation package, 2026-09-25; explicit continuation of ai-selection-jev-play-the-ball-2026-09-21). The companion summary.md in the same folder is a condensed restatement of this README and was read but not ingested separately. Revival Phase 0 gold-standard source.",
  "origin": {
    "channel": "github",
    "sender": "Jones"
  }
}
