{
  "source_id": "breakfast-product-theory-2026-03-31",
  "title": "早餐店理論與 Decision Augmentation",
  "source_type": "markdown",
  "path": "sources/inbox/breakfast-product-theory-2026-03-31.md",
  "captured_at": "2026-04-25T22:57:34.287Z",
  "content_hash": "sha256:0728094e194f4464cf303f2810f836b9301634c7724afef784c9cab91997a91e",
  "language": "zh-Hant",
  "tags": [
    "blind-assist",
    "decision-augmentation",
    "breakfast-theory",
    "mvp"
  ],
  "status": "inbox",
  "notes": "Curated from thinking_with_ai/projects as a high-value Thought Atlas source."
}
